{
  "checked_at": "2026-03-09T18:10:00.000000+00:00",
  "monitor_snapshot": {
    "local_version": "0.110.0",
    "latest_version": "0.112.0",
    "version_status": "behind",
    "recommendation": "upgrade-now",
    "repo_workflow_traits": [
      "worktree-discipline"
    ],
    "relevant_changes": [
      {
        "id": "release:0.112.0:1",
        "summary": "Permission profile updates improve approval prompts for workspace-write sessions",
        "relevance": "high",
        "reason": "Relevant because repo instructions enforce explicit approval and sandbox boundaries."
      }
    ],
    "evidence": [
      "Local Codex CLI is behind the latest verified upstream release."
    ]
  },
  "notification": {
    "status": "suppressed",
    "changed": false,
    "threshold": "upgrade-later",
    "fingerprint": "delivery-fixture-notify-fingerprint",
    "reason": "The same actionable state was already observed earlier.",
    "notes": [
      "This actionable state was already seen, so the advisor suppressed a duplicate alert."
    ]
  },
  "project_change_suggestions": [
    {
      "id": "approval-profile-review",
      "title": "Audit approval and sandbox guidance",
      "priority": "high",
      "category": "workflow",
      "rationale": "This repository encodes explicit approval and sandbox expectations, so Codex changes in that area can change operator behavior.",
      "impacted_paths": [
        "AGENTS.md"
      ],
      "next_steps": [
        "Review launcher defaults."
      ]
    }
  ],
  "implementation_brief": {
    "summary": "Codex CLI 0.110.0 -> 0.112.0 remains actionable, but the advisor already recorded this state.",
    "top_priorities": [
      "Audit approval and sandbox guidance"
    ],
    "impacted_paths": [
      "AGENTS.md"
    ],
    "notes": [
      "Already seen"
    ]
  },
  "issue_action": {
    "mode": "none",
    "requested": false,
    "notes": [
      "Tracker sync was not requested."
    ]
  }
}
