{
  "checked_at": "2026-03-09T17:50:19.987134+00:00",
  "monitor_snapshot": {
    "local_version": "0.110.0",
    "latest_version": "0.112.0",
    "version_status": "behind",
    "recommendation": "upgrade-now",
    "repo_workflow_traits": [
      "worktree-discipline",
      "approval-boundaries",
      "agents-surface"
    ],
    "relevant_changes": [
      {
        "id": "release:0.112.0:1",
        "summary": "Permission profile updates improve approval prompts for workspace-write sessions",
        "relevance": "high",
        "reason": "Relevant because repo instructions enforce explicit approval and sandbox boundaries."
      }
    ],
    "evidence": [
      "Local Codex CLI is behind the latest verified upstream release."
    ]
  },
  "notification": {
    "status": "notify",
    "changed": true,
    "threshold": "upgrade-later",
    "fingerprint": "delivery-fixture-notify-fingerprint",
    "reason": "A new actionable Codex update state was detected for this repository.",
    "notes": [
      "Advisor state file not found; treating this as a fresh evaluation."
    ]
  },
  "project_change_suggestions": [
    {
      "id": "approval-profile-review",
      "title": "Audit approval and sandbox guidance",
      "priority": "high",
      "category": "workflow",
      "rationale": "This repository encodes explicit approval and sandbox expectations, so Codex changes in that area can change operator behavior.",
      "impacted_paths": [
        "AGENTS.md",
        "docs/CODEX-OPERATING-MODEL.md",
        "scripts/codex-profile-launch.sh"
      ],
      "next_steps": [
        "Re-read approval policy guidance and compare it with the new Codex release behavior."
      ]
    },
    {
      "id": "worktree-guidance",
      "title": "Review worktree guidance and topology helpers",
      "priority": "high",
      "category": "workflow",
      "rationale": "Upstream Codex behavior changed in an area this repository uses heavily for dedicated worktree lanes.",
      "impacted_paths": [
        "AGENTS.md",
        "docs/GIT-TOPOLOGY-REGISTRY.md"
      ],
      "next_steps": [
        "Validate any worktree helper flows that assume older Codex semantics."
      ]
    }
  ],
  "implementation_brief": {
    "summary": "Codex CLI 0.110.0 -> 0.112.0 is currently 'upgrade-now' for this repository, and the advisor marked the run as 'notify'.",
    "top_priorities": [
      "Audit approval and sandbox guidance",
      "Review worktree guidance and topology helpers"
    ],
    "impacted_paths": [
      "AGENTS.md",
      "docs/CODEX-OPERATING-MODEL.md",
      "scripts/codex-profile-launch.sh"
    ],
    "notes": [
      "Notification threshold: upgrade-later",
      "Relevant change count: 1"
    ]
  },
  "issue_action": {
    "mode": "suggested",
    "requested": false,
    "notes": [
      "Tracker sync was not requested."
    ]
  }
}
